### ISSUE TITLE
Implement MPLS labeled packet receive in promisc mode

### ISSUE THREAD

**Issue by mzi77** [aabc/ipt-netflow#36]
Please implement MPLS labeled packet receive in promisc mode, should be ease modification of promisc_rcv(), now MPLS labeled IPv6/IPv4 packets are droped. Maybe I will create patch for it.

**Comment by aabc** [comment]
Do you mean [accounting of MPLS](http://www.iana.org/assignments/ipfix/ipfix.xhtml) *or* just untag MPLS packets?

I have never meet MPLS setup in linux. Can you give description of your setup? Or provide link to example/documentation.

If you want just untagging of MPLS encapsulation (you just get mirror of MPLS traffic on some port), please provide example packet dump - record several (or many) full length packets with `tcpdump` or `wireshark`.

**Comment by mzi77** [comment]
I'm using ipt-netflow on server with 10ge ethernet card conneted to passive optical TAP for traffic mirroring. ipt-netflow is in promisc mode, but most of mirrored traffic is MPLS tagged so it's dropped by ipt-netflow. MPLS accounting in ipfix export is best solutions, because it's standard based. For my needs and setup simple untagging and IPv4/v6 accounting will be sufficient. I will send tcpdump of traffic directyl to you mail, because I can't attach it here. In my setup there could be single, double tagged MPLS traffic with IPv4/IPv6 payload, untagged traffic and tagged EoMPLS/VPSL traffic on input.

**Comment by aabc** [comment]
> MPLS accounting in ipfix export is best solutions, because it's standard based.

But this may be not what you need, because it does not suppose untagging (afaik).

But, I suppose, you are using ipfix export protocol, right? (And not V5).

> In my setup there could be single, double tagged MPLS traffic with IPv4/IPv6 payload, untagged traffic and tagged EoMPLS/VPSL traffic on input.

Please send all examples (single tagged, double tagged, and EoMPLS/VPSL). Thanks!

**Comment by mzi77** [comment]
Actually I'm using v9 Netflow, but I can use IPFIX also.  MPLS fields is just another fields in netflow. Currently we are using commercial netflow probes and they are sending flows for MPLS IPv6/IPv4 tagged traffic, with MPLS fields filled with information extracted from MPLS lablels. So when proble receives MPLS labeled IP traffic, it will analyze MPLS tags and if content is IP packet, it will analyze also IP packet headers. 
I sent short sample of traffic to your mail, because I can't attach it here, please confirm, that you received it.

**Comment by aabc** [comment]
Yes, I received it, and also sent reply to you. It seems that you also have vlan tags, not just mpls. What kernel version you are using?

> So when proble receives MPLS labeled IP traffic, it will analyze MPLS tags and if content is IP packet, it will analyze also IP packet headers.

That's interesting, I didn't know about it. Would be useful to have example of such netflow traffic too (with templates captured).

**Comment by mzi77** [comment]
Yes, I have both dot1q tag and MPLS label. I have 3.10.0-229.1.2.el7.x86_64 from Centos 7-1503. I will send you all additional output on thursday after weekend, currently I'm out of office. Commercial probes can add even L7 fields like  NBAR2, HTTP, VoIP, so you can extract useful data from netflow export. Thank you for fast reply and happy easter.

**Comment by aabc** [comment]
I look forward for your captures. About L7, I assume this requires DPI, which ipt-netflow does not have (as of yet and this would be major feature). I will post here about my progress in MPLS untagging. Thanks you and happy easter too!

**Comment by aabc** [comment]
That's how I understand it right now.

1. Basically, it would be enough to just decapsulate MPLS packets (promisc related ./configure option), this should be normal for promisc, because it's *promisc* (we are 'promiscing' into MPLS) and it's configurable.
2. Additional to this, MPLS related V9/IPFIX Elements could be reported. I never had example MPLS flows, so my understanding about them is like this:
 1. I don't sure that MPLS info is *allowed* / or *supposed* to go _together_ with it's decapsulation. There could be just MPLS flows w/o underlying IP info. How useful is to report MPLS Elements with decapsulated IP packet? Should MPLS tag be a flow key?
 2. mplsTopLabelIPv4Address(47) and other routing related Elements can not be reported, because it's routing decision related and linux (at least in requested setup) do not route MPLS.
 3. You mentioned two levels of MPLS tags, so, at least, mplsTopLabelStackSection(70) and mplsLabelStackSection2(71) Elements could be used to report first two tags. Also, mplsTopLabelTTL(200) for top tag only, no element for TTL of other tags.
 3. Where is supposed EoMPLS/VPSL info to go I don't know.

**Comment by mzi77** [comment]
You can think of MPLS as network virtualization, because you can have different customers with same IP space (eg. private spaces from RFC1918) in your network, using different VRFs, so this is useful to have MPLS field in netflow export for filtering out flows from exact customer. When you just decapsulate MPLS and you are not sending MPLS field, you loose this kind of information. For my particular I need just decapsulation, so export without MPLS field is OK. Here are my answers:

1/ You are right, this is what I need right now.

2/ i. - What I saw, it's supposed to go together with decapulation. MPLS is flow key. It's useful to have MPLS label field as I wrote above. More on this at http://www.cisco.com/c/en/us/td/docs/ios/12_0s/feature/guide/fsmnf25.html

ii. sure, this can be reported only from netflow export from router with LDP running
iii. MPLS has only one own TTL, so you are right.
iv. I will do testing with commercial probes, what they are reporting. For first implemetation I think you can drop those. I think they report 0 in IP fields.

I will get back to you with results during next week.

**Comment by aabc** [comment]
Thanks. I realized that MPLS encapsulation does not save *ethertype*. This mean if something besides ipv4 or ipv6 is encapsulated, it will be (probably) impossible to determine original ethertype.

**Comment by aabc** [comment]
I implemented MPLS decapsulation in promisc, as you requested. There is no MPLS info in flows yet. I didn't test it on real traffic, so, I hope you will do it.

**Comment by mzi77** [comment]
Thank you, I will test it tomorrow and I will let you know.

**Comment by mzi77** [comment]
Hi, I cannot build current source with MPLS promics

root@10-2-16-129 ipt-netflow]# ./configure --enable-promisc --promisc-mpls 
Kernel version: 3.10.0-229.1.2.el7.x86_64 (uname)
Kernel sources: /lib/modules/3.10.0-229.1.2.el7.x86_64/build (found)
Checking for presence of include/linux/llist.h... Yes
Iptables binary version: 1.4.21 (detected from /usr/sbin/iptables)
pkg-config for version 1.4.21 exists: Yes
Checking for presence of xtables.h... Yes (using pkg-config)
Iptables include flags:   (pkg-config)
Iptables module path: /usr/lib64/xtables (pkg-config)
Searching for net-snmp-config... No.
Searching for net-snmp agent... Yes.
! You have net-snmp agent but not development package.
! net-snmp agent will not be built, to fix:
!   run:  yum install net-snmp-devel
Checking for DKMS... Yes.
! You are already have module installed via DKMS
!   it will be uninstalled on 'make install' and
!   current version of module installed afterwards.
! Use --disable-dkms option if don't want this.
Creating Makefile.. done.

  If you need some options enabled run ./configure --help
  Now run: make all install

[root@10-2-16-129 ipt-netflow]# make all install
Compiling for kernel 3.10.0-229.1.2.el7.x86_64
make -C /lib/modules/3.10.0-229.1.2.el7.x86_64/build M=/root/ipt-netflow modules CONFIG_DEBUG_INFO=y
make[1]: Entering directory `/usr/src/kernels/3.10.0-229.1.2.el7.x86_64'
  CC [M]  /root/ipt-netflow/ipt_NETFLOW.o
/root/ipt-netflow/ipt_NETFLOW.c: In function ‘promisc_rcv’:
/root/ipt-netflow/ipt_NETFLOW.c:1322:3: warning: passing argument 1 of ‘skb_pull’ makes pointer from integer without a cast [enabled by default]
   skb_pull(stack_len);
   ^
In file included from /root/ipt-netflow/ipt_NETFLOW.c:23:0:
include/linux/skbuff.h:1564:23: note: expected ‘struct sk_buff *’ but argument is of type ‘size_t’
 extern unsigned char *skb_pull(struct sk_buff *skb, unsigned int len);
                       ^
/root/ipt-netflow/ipt_NETFLOW.c:1322:3: error: too few arguments to function ‘skb_pull’
   skb_pull(stack_len);
   ^
In file included from /root/ipt-netflow/ipt_NETFLOW.c:23:0:
include/linux/skbuff.h:1564:23: note: declared here
 extern unsigned char *skb_pull(struct sk_buff *skb, unsigned int len);
                       ^
make[2]: *** [/root/ipt-netflow/ipt_NETFLOW.o] Error 1
make[1]: *** [_module_/root/ipt-netflow] Error 2
make[1]: Leaving directory `/usr/src/kernels/3.10.0-229.1.2.el7.x86_64'
make: *** [ipt_NETFLOW.ko] Error 2
[root@10-2-16-129 ipt-netflow]# make all install
Compiling for kernel 3.10.0-229.1.2.el7.x86_64
make -C /lib/modules/3.10.0-229.1.2.el7.x86_64/build M=/root/ipt-netflow modules CONFIG_DEBUG_INFO=y
make[1]: Entering directory `/usr/src/kernels/3.10.0-229.1.2.el7.x86_64'
  CC [M]  /root/ipt-netflow/ipt_NETFLOW.o
/root/ipt-netflow/ipt_NETFLOW.c: In function ‘promisc_rcv’:
/root/ipt-netflow/ipt_NETFLOW.c:1322:3: warning: passing argument 1 of ‘skb_pull’ makes pointer from integer without a cast [enabled by default]
   skb_pull(stack_len);
   ^
In file included from /root/ipt-netflow/ipt_NETFLOW.c:23:0:
include/linux/skbuff.h:1564:23: note: expected ‘struct sk_buff *’ but argument is of type ‘size_t’
 extern unsigned char *skb_pull(struct sk_buff *skb, unsigned int len);
                       ^
/root/ipt-netflow/ipt_NETFLOW.c:1322:3: error: too few arguments to function ‘skb_pull’
   skb_pull(stack_len);
   ^
In file included from /root/ipt-netflow/ipt_NETFLOW.c:23:0:
include/linux/skbuff.h:1564:23: note: declared here
 extern unsigned char *skb_pull(struct sk_buff *skb, unsigned int len);
                       ^
make[2]: *** [/root/ipt-netflow/ipt_NETFLOW.o] Error 1
make[1]: *** [_module_/root/ipt-netflow] Error 2
make[1]: Leaving directory `/usr/src/kernels/3.10.0-229.1.2.el7.x86_64'
make: *** [ipt_NETFLOW.ko] Error 2
[root@10-2-16-129 ipt-netflow]#

**Comment by aabc** [comment]
Yes, "last minute change" went untested, and of course it was with simple mistake. I commited with `--amend` new version into github, but because of *force push* you may need to `git clone` ipt-netflow again (not just `git pull`) to get correct source. Sorry.

**Comment by mzi77** [comment]
I can compile and run git version now. I will do some testing now.

**Comment by mzi77** [comment]
Seems that everything is working OK, I will do additional testing next week.

Is it possible to spread work from one NIC across CPUs ?

Have nice weekend !

Here's ouput from test exporter:

[root@10-2-16-129 ipt-netflow]# cat /proc/net/stat/ipt_netflow
ipt_NETFLOW 2.1-20-gf97e986, srcversion 9F879E3B79801B9F4EC2179; llist promisc+mpls vlan
Protocol version 9 (netflow), refresh-rate 20, timeout-rate 30, (templates 20, active 20).
Timeouts: active 60s, inactive 15s. Maxflows 2000000
Promisc hack is enabled (observed 254227806 packets, discarded 33317944).
Flows: active 58831 (peak 78245 reached 0d0h17m ago), mem 13393K, worker delay 12/1000 [1..100] (11 ms, 0 us, 270:0 0 [cpu0]).
Hash: size 655360 (mem 5120K), metric 1.04 [1.02, 1.00, 1.00]. InHash: 3533675 pkt, 3380470 K, InPDU 118, 66069.
Rate: 1164782872 bits/sec, 151829 packets/sec; Avg 1 min: 1174773180 bps, 153737 pps; 5 min: 1138204343 bps, 149194 pps
cpu#     pps; <search found new [metric], trunc frag alloc maxflows>, traffic: <pkt, bytes>, drop: <pkt, bytes>
Total 151829; 12186366 214719022 5931112 [1.05],    0  206    0    0, traffic: 220650134, 166362 MB, drop: 0, 0 K
cpu0  151829; 12186366 214719022 5931112 [1.02],    0  206    0    0, traffic: 220650134, 166362 MB, drop: 0, 0 K
cpu1       0;      0      0      0 [1.00],    0    0    0    0, traffic: 0, 0 MB, drop: 0, 0 K
cpu2       0;      0      0      0 [1.00],    0    0    0    0, traffic: 0, 0 MB, drop: 0, 0 K
cpu3       0;      0      0      0 [1.00],    0    0    0    0, traffic: 0, 0 MB, drop: 0, 0 K
Export: Rate 163804 bytes/s; Total 211931 pkts, 282 MB, 5872259 flows; Errors 0 pkts; Traffic lost 0 pkts, 0 Kbytes, 0 flows.
sock0: 10.1.1.2:8000, sndbuf 212992, filled 1, peak 9217; err: sndbuf reached 0, connect 0, cberr 244, other 0
[root@10-2-16-129 ipt-netflow]#

**Comment by aabc** [comment]
Thanks!

> Promisc hack is enabled (observed 254227806 packets, discarded 33317944).

I wonder what could be discarded.

> Is it possible to spread work from one NIC across CPUs ?

Yes. https://www.kernel.org/doc/Documentation/networking/scaling.txt

**Comment by mzi77** [comment]
Yes, number of discarded packets is quite high, 

Promisc hack is enabled (observed 5423255299 packets, discarded 659613930).

there is very low EoMPLS traffic on this line so there should be all packets analysed.

Is there some way do debug discarded packets ? It will be helpful.

**Comment by aabc** [comment]
Could there be non-IP packets?

**Comment by mzi77** [comment]
Yes, but not so much. All packets are IPv4/6 with no, one or two MPLS lables. Ethernet frames have vlan tag.

**Comment by aabc** [comment]
I pushed small statistics accounting into `test` branch. You can `git clone https://github.com/aabc/ipt-netflow.git -b test` to get it, or just `git checkout test` after you pull.

**Comment by mzi77** [comment]
Great, seems like most packets are droped because of ipver (?), that's strange. Maybe some bug in MPLS decapsulation ?

Promisc drop stat: noshare 0, stack 198, iphdr 72, ipver 545669, proto 0

**Comment by aabc** [comment]
Please show both lines of promisc stat: together:

> Promisc hack is enabled (observed X packets, discarded X).
> Promisc drop stat: ...

`ipver` increments for non ipv4/ipv6 packets (which is supposed to be 13% for you).

**Comment by mzi77** [comment]
Here it is

Promisc hack is enabled (observed 4880759741 packets, discarded 727858288).
Promisc drop stat: noshare 0, stack 221576, iphdr 183694, ipver 628885782, proto 3

I added debug printk befpre

NETFLOW_STAT_INC(promisc_ipver);

printk(KERN_DEBUG "ipt_NETFLOW: protocol: %02x len: %x \n",ip_hdr(skb)->version,stack_len);

and I'm seeing strange protocols and stack_len values. Is this debug printf correct ? More verbose debug will be helpful, eg. same like LOG targed. At least MPLS label stack for debuging droped packets.

**Comment by aabc** [comment]
Thanks. `0+221576+183694+628885782+3` doesn't match `727858288`, because there is also 40527 drops inside of ipv4/ipv6 handlers. But, it seems, 14% drops is `ipver` cause.

> I'm seeing strange protocols and stack_len values.

Maybe you can show to me.

> Is this debug printf correct ?
Yes.

**Comment by aabc** [comment]
It will be useful also  if you add output of skb->len and skb->data_len.

**Comment by aabc** [comment]
And skb->mac_len please.

**Comment by mzi77** [comment]
I modified printk line
                         printk(KERN_DEBUG "ipt_NETFLOW: protocol: %02x stack_len: %u skb_len: %u skb_data_len: %u skb_mac_len: %u \n",ip_hdr(skb)->version,stack_len,skb->len,skb->data_len,skb->mac_len);

Here's sample output
[887895.289524] ipt_NETFLOW: protocol: 00 stack_len: 4 skb_len: 204 skb_data_len: 203 skb_mac_len: 14 
[887895.289545] ipt_NETFLOW: protocol: 00 stack_len: 4 skb_len: 204 skb_data_len: 203 skb_mac_len: 14 
[887895.289582] ipt_NETFLOW: protocol: 00 stack_len: 4 skb_len: 204 skb_data_len: 203 skb_mac_len: 14 
[887895.290037] ipt_NETFLOW: protocol: 00 stack_len: 4 skb_len: 601 skb_data_len: 600 skb_mac_len: 14 
...
[887807.429180] ipt_NETFLOW: protocol: 0c stack_len: 8 skb_len: 1496 skb_data_len: 1495 skb_mac_len: 14 
[887807.429181] ipt_NETFLOW: protocol: 09 stack_len: 8 skb_len: 1496 skb_data_len: 1495 skb_mac_len: 14 
[887807.429186] ipt_NETFLOW: protocol: 08 stack_len: 8 skb_len: 1496 skb_data_len: 1495 skb_mac_len: 14 
[887807.429199] ipt_NETFLOW: protocol: 08 stack_len: 8 skb_len: 1496 skb_data_len: 1495 skb_mac_len: 14 
[887807.429212] ipt_NETFLOW: protocol: 08 stack_len: 8 skb_len: 1496 skb_data_len: 1495 skb_mac_len: 14 
[887807.429217] ipt_NETFLOW: protocol: 0c stack_len: 8 skb_len: 1496 skb_data_len: 1495 skb_mac_len: 14 
[887807.429224] ipt_NETFLOW: protocol: 08 stack_len: 8 skb_len: 1496 skb_data_len: 1495 skb_mac_len: 14 
[887807.429236] ipt_NETFLOW: protocol: 08 stack_len: 8 skb_len: 1496 skb_data_len: 1495 skb_mac_len: 14 
[887807.429249] ipt_NETFLOW: protocol: 0c stack_len: 8 skb_len: 1496 skb_data_len: 1495 skb_mac_len: 14 
[887807.429251] ipt_NETFLOW: protocol: 08 stack_len: 8 skb_len: 1496 skb_data_len: 1495 skb_mac_len: 14 
[887807.429260] ipt_NETFLOW: protocol: 08 stack_len: 8 skb_len: 1496 skb_data_len: 1495 skb_mac_len: 14 
[887807.429273] ipt_NETFLOW: protocol: 08 stack_len: 8 skb_len: 1496 skb_data_len: 1495 skb_mac_len: 14 
[887807.429275] ipt_NETFLOW: protocol: 00 stack_len: 24 skb_len: 32 skb_data_len: 31 skb_mac_len: 14 
[887807.429285] ipt_NETFLOW: protocol: 0c stack_len: 8 skb_len: 1496 skb_data_len: 1495 skb_mac_len: 14 
[887807.429291] ipt_NETFLOW: protocol: 09 stack_len: 8 skb_len: 1456 skb_data_len: 1455 skb_mac_len: 14 
[887807.429303] ipt_NETFLOW: protocol: 09 stack_len: 8 skb_len: 1496 skb_data_len: 1495 skb_mac_len: 14 
[887807.429473] ipt_NETFLOW: protocol: 0c stack_len: 8 skb_len: 1416 skb_data_len: 1415 skb_mac_len: 14 
[887807.429480] ipt_NETFLOW: protocol: 0c stack_len: 8 skb_len: 1416 skb_data_len: 1415 skb_mac_len: 14 
[887807.429491] ipt_NETFLOW: protocol: 0c stack_len: 8 skb_len: 1496 skb_data_len: 1495 skb_mac_len: 14 
[887807.429512] ipt_NETFLOW: protocol: 05 stack_len: 16 skb_len: 36 skb_data_len: 35 skb_mac_len: 14 
[887807.429527] ipt_NETFLOW: protocol: 0c stack_len: 8 skb_len: 1496 skb_data_len: 1495 skb_mac_len: 14 
[887807.429532] ipt_NETFLOW: protocol: 03 stack_len: 20 skb_len: 184 skb_data_len: 183 skb_mac_len: 14 
[887807.429538] ipt_NETFLOW: protocol: 01 stack_len: 8 skb_len: 1405 skb_data_len: 1404 skb_mac_len: 14 
[887807.429550] ipt_NETFLOW: protocol: 09 stack_len: 8 skb_len: 1496 skb_data_len: 1495 skb_mac_len: 14 
[887807.429553] ipt_NETFLOW: protocol: 0c stack_len: 8 skb_len: 1496 skb_data_len: 1495 skb_mac_len: 14 
[887807.429561] ipt_NETFLOW: protocol: 00 stack_len: 16 skb_len: 40 skb_data_len: 39 skb_mac_len: 14 
[887807.429591] ipt_NETFLOW: protocol: 0c stack_len: 8 skb_len: 1496 skb_data_len: 1495 skb_mac_len: 14 
[887807.429632] ipt_NETFLOW: protocol: 05 stack_len: 8 skb_len: 1496 skb_data_len: 1495 skb_mac_len: 14 
[887807.429642] ipt_NETFLOW: protocol: 0d stack_len: 8 skb_len: 1496 skb_data_len: 1495 skb_mac_len: 14 
[887807.429658] ipt_NETFLOW: protocol: 00 stack_len: 8 skb_len: 1496 skb_data_len: 1495 skb_mac_len: 14 
[887807.429660] ipt_NETFLOW: protocol: 0c stack_len: 8 skb_len: 1496 skb_data_len: 1495 skb_mac_len: 14 
[887807.429672] ipt_NETFLOW: protocol: 09 stack_len: 8 skb_len: 1496 skb_data_len: 1495 skb_mac_len: 14 
[887807.429675] ipt_NETFLOW: protocol: 0b stack_len: 16 skb_len: 37 skb_data_len: 36 skb_mac_len: 14 
[887807.429680] ipt_NETFLOW: protocol: 0c stack_len: 8 skb_len: 1496 skb_data_len: 1495 skb_mac_len: 14 
[887807.429689] ipt_NETFLOW: protocol: 0b stack_len: 16 skb_len: 37 skb_data_len: 36 skb_mac_len: 14 
[887807.429693] ipt_NETFLOW: protocol: 0c stack_len: 8 skb_len: 1416 skb_data_len: 1415 skb_mac_len: 14

**Comment by aabc** [comment]
Numbers looks good. To dump header of the packet add this:
```
print_hex_dump_bytes("", DUMP_PREFIX_OFFSET, skb_mac_header(skb), skb->data - skb_mac_header(skb) + 1);
```
This will be from L2 up to first byte of L3, including all MPLS labels. Will be interesting if you show some examples.

**Comment by mzi77** [comment]
I added

print_hex_dump_bytes("ipt_NETFLOW dump:", DUMP_PREFIX_OFFSET, skb_mac_header(skb), skb->data - skb_mac_header(skb) + 1);

enabled dynamic debug for that line and I got eg.
[892135.401524] ipt_NETFLOW dump:00000000: 10 05 ca 9d 59 40 00 1a 30 db 7c 00 88 47 00 01  ....Y@..0.|..G..
[892135.402985] ipt_NETFLOW dump:00000010: 5d 3f 45 00 05 dc 93

dst mac: 10 05 ca 9d 59 40
src mac: 00 1a 30 db 7c 00
ethertype: 88 47
label: 00 01 5d 3f = 1 0101 1101 0011 1111 - so bottom of stack is set
45 00 05 dc 93 - begin of IP header (version 4 etc.)

so there must be some bug in mpls decaps handling - testing of "bottom of stack bit"

**Comment by aabc** [comment]
What was stack_len for this dump?

**Comment by mzi77** [comment]
sorry, I disabled my printk, enabled again, similar output, seem like stack_len is +4

[ 1513.414753] ipt_NETFLOW: protocol: 09 stack_len: 8 skb_len: 1496 skb_data_len: 1495 skb_mac_len: 14 
[ 1513.414754] ipt_NETFLOW dump:00000000: 10 05 ca 9d 59 40 00 1a 30 db 7c 00 88 47 00 01  ....Y@..0.|..G..
[ 1513.414755] ipt_NETFLOW dump:00000010: 7d 3f 45 00 05 dc 93

**Comment by aabc** [comment]
Thanks. That's interesting. :neutral_face:

**Comment by aabc** [comment]
I pushed into test branch solution you may test.

**Comment by mzi77** [comment]
Seems OK now, 0 droped packets. I will inspect netflow export tomorrow. 

Thanks for quick fix.

[root@10-2-16-129 ipt-netflow]# cat /proc/net/stat/ipt_netflow
ipt_NETFLOW 2.1-22-g83725a4, srcversion 76B7421467A9092B1C8FAB2; llist promisc+mpls vlan
Protocol version 9 (netflow), refresh-rate 20, timeout-rate 30, (templates 8, active 8).
Timeouts: active 30s, inactive 15s. Maxflows 2000000
Promisc hack is enabled (observed 120366857 packets, discarded 0).
Promisc drop stat: noshare 0, stack 0, iphdr 0, ipver 0, proto 0
Flows: active 60489 (peak 64128 reached 0d0h7m ago), mem 13626K, worker delay 12/1000 [1..100] (4 ms, 0 us, 275:0 2 [cpu1]).
Hash: size 655360 (mem 5120K), metric 1.06 [1.01, 1.00, 1.00]. InHash: 4384219 pkt, 4350435 K, InPDU 1370, 507379.
Rate: 2296946450 bits/sec, 274702 packets/sec; Avg 1 min: 2140777542 bps, 259344 pps; 5 min: 1858098900 bps, 233499 pps
cpu#     pps; <search found new [metric], trunc frag alloc maxflows>, traffic: <pkt, bytes>, drop: <pkt, bytes>
Total 274702; 6016502 118184269 1697961 [1.05],    0    0    0    0, traffic: 119882230, 111433 MB, drop: 0, 0 K
cpu0  274702; 6016502 118184283 1697962 [1.01],    0    0    0    0, traffic: 119882245, 111433 MB, drop: 0, 0 K
cpu1       0;      0      0      0 [1.00],    0    0    0    0, traffic: 0, 0 MB, drop: 0, 0 K
cpu2       0;      0      0      0 [1.00],    0    0    0    0, traffic: 0, 0 MB, drop: 0, 0 K
cpu3       0;      0      0      0 [1.00],    0    0    0    0, traffic: 0, 0 MB, drop: 0, 0 K
Export: Rate 152456 bytes/s; Total 57549 pkts, 76 MB, 1637444 flows; Errors 0 pkts; Traffic lost 0 pkts, 0 Kbytes, 0 flows.
sock0: 10.1.1.2:8000, sndbuf 212992, filled 1, peak 16129; err: sndbuf reached 0, connect 0, cberr 513, other 0
[root@10-2-16-129 ipt-netflow]#

**Comment by aabc** [comment]
Thats good. I still need think more about implications of using *pskb_may_pull()*.

**Comment by aabc** [comment]
> I still need think more about implications of using pskb_may_pull().

I thinked it over, all should be good, because *pskb_may_pull* (further in [*pskb_expand_head*](https://github.com/torvalds/linux/blob/master/net/core/skbuff.c#L1173)) preserves headroom, thus, no need to do pull/push trick, like in vlan untagging code.

**Comment by mzi77** [comment]
Everything seem OK after one day. I checked export and it seems OK.

Promisc hack is enabled (observed 13015675175 packets, discarded 6).
Promisc drop stat: noshare 0, stack 0, iphdr 0, ipver 0, proto 6

**Comment by aabc** [comment]
Nice! Thanks for testing! :smile:

**Comment by aabc** [comment]
I experimentally implemented MPLS-aware NetFlow feature we discussed before. (I.e. exporting MPLS-related Elements for decapsulated flows.) If you still interested I would be thankful if you test it in your setup. Basic testing I already did, thanks to your packet captures.

**Comment by mzi77** [comment]
Great, I will test tomorrow.

**Comment by mzi77** [comment]
Sorry for delay, I will do testing next week.

**Comment by mzi77** [comment]
Did some testing today, label field in flows seems OK. But IPv6 traffic is discarded, I can't see no IPv6 flows in export and I can see increasing discarded packet count.

[root@10-2-16-129 ipt-netflow]# cat /proc/net/stat/ipt_netflow
ipt_NETFLOW 2.1-22-g5049643, srcversion F864ED428C2B0ABA51251E2; llist promisc+mpls vlan
Protocol version 9 (netflow), refresh-rate 20, timeout-rate 30, (templates 17, active 17).
Timeouts: active 30s, inactive 15s. Maxflows 2000000
Promisc hack is enabled (observed 873343039 packets, discarded 208496).
Flows: active 139389 (peak 210888 reached 0d0h7m ago), mem 26899K, worker delay 4/1000 [1..100] (3 ms, 0 us, 268:0 0 [cpu2]).
Hash: size 655360 (mem 5120K), metric 1.10 [1.09, 1.00, 1.00]. InHash: 5923205 pkt, 5828398 K, InPDU 110, 102767.
Rate: 2845919818 bits/sec, 360530 packets/sec; Avg 1 min: 2852323944 bps, 366028 pps; 5 min: 2959587936 bps, 377374 pps
cpu#     pps; <search found new [metric], trunc frag alloc maxflows>, traffic: <pkt, bytes>, drop: <pkt, bytes>
Total 360530; 103664229 853157659 18414800 [1.11],    0    0    0    0, traffic: 871572459, 832949 MB, drop: 0, 0 K
cpu0  360530; 103664229 853157659 18414800 [1.09],    0    0    0    0, traffic: 871572459, 832949 MB, drop: 0, 0 K
cpu1       0;      0      0      0 [1.00],    0    0    0    0, traffic: 0, 0 MB, drop: 0, 0 K
cpu2       0;      0      0      0 [1.00],    0    0    0    0, traffic: 0, 0 MB, drop: 0, 0 K
cpu3       0;      0      0      0 [1.00],    0    0    0    0, traffic: 0, 0 MB, drop: 0, 0 K
Export: Rate 474756 bytes/s; Total 797459 pkts, 1057 MB, 18273356 flows; Errors 68 pkts; Traffic lost 55008 pkts, 54456 Kbytes, 2040 flows.
sock0: 10.1.1.2:8000, sndbuf 212992, filled 1, peak 214273; err: sndbuf reached 68, connect 0, cberr 130, other 0
[root@10-2-16-129 ipt-netflow]#

**Comment by aabc** [comment]
Do you think this so much (0.02%) discards is abnormal? Does its number correlate with amount of IPv6  packets? I basically didn't change anything about promisc logic in latest patch.

**Comment by mzi77** [comment]
I tried ipt_NETFLOW 2.1-22-g83725a4, srcversion 76B7421467A9092B1C8FAB2, with same result, now I see discarded packets ( ipver 26691) and no IPv6 in export. I can see iPv6 traffic on interface using tcpdump. That's stange, because this version shown no discards before.

[root@10-2-16-129 ipt-netflow]# tcpdump -n -i  ens2f1 "ip6"|more
tcpdump: WARNING: ens2f1: no IPv4 address assigned
tcpdump: verbose output suppressed, use -v or -vv for full protocol decode
listening on ens2f1, link-type EN10MB (Ethernet), capture size 65535 bytes
09:54:10.417878 IP6 2a00:1450:400c:c05::9a.https > 2a01:430:17:1::ffff:564.39735: Flags [S.], seq 3691597390, ack 1239359107, win 42594, options [mss 1386,sackOK,TS val 3557608648 ecr 2668039805,nop,wscale 7], length 0
09:54:10.420215 IP6 2a01:430:120::4d5d:db6e.domain > 2001:1ae8:2:4060::1:2.45732: 41261*- 1/2/5 A 147.229.21.130 (199)
09:54:10.423705 IP6 2001:41d0:1:6678::1.12098 > 2a01:430:17:1::ffff:564.22413: UDP, length 1120
09:54:10.429165 IP6 2a00:1450:400c:c05::76.http > 2a01:430:17:1::ffff:491.45917: Flags [.], ack 1675670733, win 333, options [nop,nop,TS val 3800773075 ecr 3656386602], length 0
09:54:10.430170 IP6 2607:ff48:1:2::3f6f:a3b0.18887 > 2a01:430:17:1::ffff:564.40682: Flags [.], ack 151813818, win 309, options [nop,nop,TS val 1741924243 ecr 2668039680], length 0
09:54:10.436185 IP6 2001:67c:22f8:6:222:4dff:fe7b:7bb4.58345 > 2400:cb00:2049:1::adf5:3a94.domain: 4658 [1au] A? extratorrent.cc. (44)
09:54:10.440427 IP6 2a01:430:13::169.http > 2a02:598:2::1036.65087: Flags [.], seq 1094414517:1094415945, ack 3484517955, win 414, options [nop,nop,TS val 3104206173 ecr 4252952742], length 1428

here's output

[root@10-2-16-129 ipt-netflow]# cat /proc/net/stat/ipt_netflow
ipt_NETFLOW 2.1-22-g83725a4, srcversion 76B7421467A9092B1C8FAB2; llist promisc+mpls vlan
Protocol version 9 (netflow), refresh-rate 20, timeout-rate 30, (templates 8, active 8).
Timeouts: active 30s, inactive 15s. Maxflows 2000000
Promisc hack is enabled (observed 100456617 packets, discarded 26691).
Promisc drop stat: noshare 0, stack 0, iphdr 0, ipver 26691, proto 0
Flows: active 113975 (peak 124410 reached 0d0h5m ago), mem 21147K, worker delay 4/1000 [1..100] (2 ms, 0 us, 287:0 0 [cpu0]).
Hash: size 655360 (mem 5120K), metric 1.07 [1.05, 1.00, 1.00]. InHash: 3960072 pkt, 3877506 K, InPDU 48, 23082.
Rate: 1937165002 bits/sec, 249081 packets/sec; Avg 1 min: 2044594590 bps, 260059 pps; 5 min: 1918634594 bps, 242406 pps
cpu#     pps; <search found new [metric], trunc frag alloc maxflows>, traffic: <pkt, bytes>, drop: <pkt, bytes>
Total 249081; 8413369 97418211 2461467 [1.08],    0    0    0    0, traffic: 99879678, 94343 MB, drop: 0, 0 K
cpu0  249081; 8413369 97418214 2461467 [1.05],    0    0    0    0, traffic: 99879681, 94343 MB, drop: 0, 0 K
cpu1       0;      0      0      0 [1.00],    0    0    0    0, traffic: 0, 0 MB, drop: 0, 0 K
cpu2       0;      0      0      0 [1.00],    0    0    0    0, traffic: 0, 0 MB, drop: 0, 0 K
cpu3       0;      0      0      0 [1.00],    0    0    0    0, traffic: 0, 0 MB, drop: 0, 0 K
Export: Rate 324093 bytes/s; Total 82201 pkts, 109 MB, 2347482 flows; Errors 0 pkts; Traffic lost 0 pkts, 0 Kbytes, 0 flows.
sock0: 10.1.1.2:8000, sndbuf 212992, filled 1, peak 11521; err: sndbuf reached 0, connect 0, cberr 0, other 0
[root@10-2-16-129 ipt-netflow]#

**Comment by mzi77** [comment]
I did some debug and drops are 2 labeled EoMPLS packets, which is OK. 

So drops are OK, but I see no IPv6 export both with new and old version.

**Comment by aabc** [comment]
Can you send some example captures? In your previous capture I don't see ip6 packets. Also, EoMPLS packets would be interesting.

**Comment by aabc** [comment]
> I can see iPv6 traffic on interface using tcpdump.

Also make sure you added NETFLOW rule into ip6tables and its counters `ip6tables -L -n -v -x` are increasing.

**Comment by mzi77** [comment]
I'm sending you dumps, I got error in test script, I was adding ip6tables rule with no version 9 enabled in ipt-netflow, so it was skiped. Now IPv6 flows are exported. Sorry for that. In dumps you can see EoMPLS packets carrying IPv4 traffic inside PW.

**Comment by aabc** [comment]
> so it was skipped. 

Probably, I should remove strictness from this check and leave only warning, to avoid such mistakes.

Thanks for the packet dumps, I received them!

**Comment by aabc** [comment]
Hm, I wonder how it's supposed to be determined that it's EoMPLS. Do you have any ideas?

**Comment by mzi77** [comment]
PW is signaled between routers using LDP (or can be using RSVP) , so there's established path for labeled packets inside network, LSR will switch those packets according to labels and destination router will know from top label that this packet is EoMPLS and will decapsulate it and send out to end port. So this missing piece information is inside established state inside network.

**Comment by aabc** [comment]
Any idea how I could determine it? I see difference between EoMPLS and MPLS packets that you sent me is `MPLS Experimental Bits: 3` in EoMPLS, is it significant? Wireshark determines that there is Ethernet frame, but this could be just heuristical guess. (Like, if first half byte is not `4` or `6` then it's probably Ethernet frame.)

Also, if decapsulate Ethernet frame from EoMPLS, how do you think additional MAC addresses should be reported in Netflow? Maybe you have examples from other sensors?

**Comment by mzi77** [comment]
Experimental bit is used for QoS in MPLS - it's similar to CoS bits in vlan tag. I think decapsulation of EoMPLS is pretty hard, because payload could be pure L2 protocol, Eg. spanning tree, LLDP, ARP etc. It can be even MPLS packet, when you are providing PW as L2 transport for some customer, which is using MPLS in his network. I guess, that wireshark is doing some heuristics on that as you suggested. I will send you some exports from other probes, I think they are reporting only labels fields and no IP fields in flows, but I must confirm that. We have state holiday tomorrow, so maybe on Monday.

**Comment by aabc** [comment]
Have nice holidays! I look forward for your feedback. Thanks!

**Comment by mzi77** [comment]
I'm sorry I'll be out till 3th Jun, I will do additional testing after that date.

**Comment by mzi77** [comment]
Hi, sorry for delay, I'm back. I sent you output from commercial probe. It's decapsulating EoMPLS traffic. If there's IPv4 packet carried by EoMPLS it's analysed.

**Comment by eth0rob** [comment]
Hi, any specific information on how to enable mpls label packet receive?
I tried with latest version of ipt_netflow running in pre-routing chain on eth interface that is receiving MPLS and VLAN encapsulated traffic but the only records I see exported are native IP traffic.

**Comment by aabc** [comment]
@eth0rob Pls, try `README.promisc`.

**Comment by eth0rob** [comment]
Hi aabc, yes I have it working in promiscuous mode and I see promisc traffic in the netflow v9 export, but I just don't see records for any of the traffic that is inside MPLS.  I have configured with --enable-promisc --promisc-mpls and --enable-vlan.  My users traffic is double tagged with MPLS and also has a single VLAN tag.  Using debian 9.9

**Comment by eth0rob** [comment]
If I do grep Promisc /proc/net/stat/ipt_netflow
Promisc hack is enabled (observed 49933435 packets, discarded 49618947).
Perhaps discarded is the MPLS traffic?

**Comment by eth0rob** [comment]
[pcap-raw.zip](https://github.com/aabc/ipt-netflow/files/3308243/pcap-raw.zip)

There is also an VPLS PW Ethernet control word header present (see attached sample pcap).  Perhaps that would be causing a problem?

**Comment by aabc** [comment]
@eth0rob Most probably.

**Comment by aabc** [comment]
@eth0rob I added commit to skip PW Control Word. Can you test?

**Comment by eth0rob** [comment]
Updated and installed new commit but seeing the same results unfortunately.

I have attached a pcap file of the netflow traffic output.  Most of the records are for port 646 traffic which is just the LDP protocol sent between MPLS routers  (no MPLS or VPLS headers on these packets).

[test2.zip](https://github.com/aabc/ipt-netflow/files/3312237/test2.zip)


Here are my settings
Please let me know if you require any other information.

root@alex-pcap:/home/rob/ipt-netflow# sysctl net.netflow
net.netflow.active_timeout = 1800
net.netflow.debug = 0
net.netflow.destination = 100.64.0.181:2055
net.netflow.flush = 0
net.netflow.hashsize = 655360
net.netflow.inactive_timeout = 15
net.netflow.maxflows = 2000000
net.netflow.promisc = 1
net.netflow.protocol = 9
net.netflow.refresh-rate = 20
net.netflow.scan-min = 1
net.netflow.sndbuf = 212992
net.netflow.timeout-rate = 30

root@alex-pcap:/home/rob/ipt-netflow# iptables -t raw -L
Chain PREROUTING (policy ACCEPT)
target     prot opt source               destination         
NETFLOW    all  --  anywhere             anywhere            NETFLOW 

Chain OUTPUT (policy ACCEPT)
target     prot opt source               destination

**Comment by aabc** [comment]
@eth0rob Please double check that correct version is loaded in the kernel. People sometimes forget to reload the module. Also, check that promisc packet counters are reset and `discarded` counter is increasing at the same speed ad `observed`.

> Promisc hack is enabled (observed 49933435 packets, discarded 49618947).

**Comment by aabc** [comment]
@eth0rob (Well, it seems that `skb->protocol` was not set correctly, so it's not working, sorry.)

Need more thinking to decide what to do with PW MPLS use case. Currently, the code expects IP header just after MPLS labels, but in your case, there is another Ethernet frame.

MPLS support was experimental and there is not much feedback (or packet examples) was given. Probably, it's a rarely used feature. @mzi77 reported that EoMPLS was parsed correctly, but I'm not sure now.

**Comment by eth0rob** [comment]
@aabc it would be great to see support for this.  Layer 2 VPN's are very common these days with service provider networks.  Your software is the first non commercial product I've seen that can handle MPLS encapsulated flows properly.  PW/EoMPLS/VPLS are just an extension of this where the next header after the MPLS label or the control word is Ethernet, followed by VLAN and finally IP.  I am happy to provide more packet samples if required :)

**Comment by aabc** [comment]
@eth0rob If you have different MPLS examples it would be great to see them. Especially I now want to see EoMPLS to check old code.

**Comment by aabc** [comment]
I found some MPLS samples at https://packetlife.net/captures/category/mpls/
`EoMPLS.cap` and `MPLS_encapsulation.cap` it seems is like ipt-netflow currently supports.
`EoMPLS_802.1q.pcap.cap` is similar to your case.

**Comment by eth0rob** [comment]
@aabc yes correct.  EoMPLS_802.1q.pcap.cap is very similar.  In some cases there may only be one MPLS label present though due to penultimate hop popping behavior on some routers where the top label is removed before being sent to the last router in the chain.  The dot1q header may or may not be present as well.  Sometimes customers will use VLAN trunking, but in other cases they just use standard Ethernet with no dot1q tags.  It would be good if ipt_netflow was able to detect the presence of the dot1q tag and either record it in the resulting flow record or just discard it and record the encapsulated IP flow.
EoMPLS.cap is also close to my example, but in my sample we only have one MPLS header due to the penultimate hop popping behavior.

**Comment by eth0rob** [comment]
@aabc on closer inspection I think wireshark is not interpreting my pcap files correctly.  In my sample capture the CW is not actually present, but Wireshark has no way of knowing this because this is agreed upon out of band by the routers and there are no other fields within the MPLS header to indicate its presence.  So wireshark assumes it is present.  I noticed this when looking at the src and dst mac addresses within the EoMPLS packet, they didnt match up with the actual addresses in use by the customer.  They are in fact shifted 4 bytes over by wireshark because it thinks the CW is present.
So in summary, most of my traffic matches the profile shown in EoMPLS_802.1q but only one MPLS label in the stack and now PW Ethernet Control Word is present.
Perhaps a way to tell ipt_Netflow what type of EoMPLS traffic it is seeing so it can dissect the packet correctly?

**Comment by eth0rob** [comment]
Attached screenshot of decode settings in wireshark required to display the packet correctly.

![Capture](https://user-images.githubusercontent.com/51975652/60059984-d7764980-9742-11e9-8561-e6ac5d064a11.PNG)

**Comment by aabc** [comment]
@eth0rob Thanks for pointing that out. I think we could start with just not interpreting CW at all. Otherwise, to configure where CW is present and where it isn't will be too complicated.

**Comment by aabc** [comment]
@eth0rob So you basically can not control what is encapsulated in MPLS? Customers can put vlan, multiple vlans, or raw eth, or even raw ip as they wish? We need to determine heuristic how to distinguish this.

**Comment by eth0rob** [comment]
with EoMPLS and VPLS we know the first header is always going to be Ethernet, but the customer may or may not use VLAN dot1q tags before we see the IP header.

**Comment by eth0rob** [comment]
@aabc and we control if the PW control word is configured or not.

**Comment by eth0rob** [comment]
@aabc When I say the first header is going to be Ethernet, I mean the first header after the MPLS headers :)

**Comment by aabc** [comment]
> with EoMPLS and VPLS we know the first header is always going to be Ethernet

@eth0rob First packets of `EoMPLS.cap` is an example where first header is ipv4 without eth.

>     [Protocols in frame: eth:ethertype:mpls:ip:udp:ldp]

**Comment by eth0rob** [comment]
@aabc Yeah I have not seen that before.  EoMPLS should be Ethernet inside MPLS by definition.  If it is just IP inside MPLS then that is not what I would call EoMPLS.  That would actually just be an IPv4 MPLS VPN also known as VPN-IP4 or VRF.

**Comment by eth0rob** [comment]
https://packetlife.net/media/captures/MPLS_encapsulation.cap

The above sample is similar but in the case of ipv4 MPLS VPN there would be two MPLS labels present.  The second label indicates the VPN ID so that the end routers know what customer the packet belongs to.
