### ISSUE TITLE
Netflow over IPv6

### ISSUE THREAD

**Issue by ddimension** [aabc/ipt-netflow#172]
Hi!
We are using ipt-netflow with a IPv6 transport network for the flows. We have an 1500 byte MTU on that link.
<pre>
15:51:24.612159 IP6 123:123:123:999:0:ffff:d:0 > 123:123:f030:2::5:0: frag (0|1448) 60315 > 9000: UDP, bad length 1464 > 1440
15:51:24.612181 IP6 123:123:123:999:0:ffff:d:0 > 123:123:f030:2::5:0: frag (1448|24)
15:51:38.355902 IP6 123:123:123:999:0:ffff:d:0 > 123:123:f030:2::5:0: frag (0|1448) 60315 > 9000: UDP, bad length 1464 > 1440
15:51:38.355923 IP6 123:123:123:999:0:ffff:d:0 > 123:123:f030:2::5:0: frag (1448|24)
</pre>
ipt-netflow should  check which MTU is corrent (in that case 1440)  and send the packets in with the correct size. In this example, it should send 2 packets.

**Comment by ddimension** [comment]
For the moment, we changed the #define NETFLOW5_RECORDS_MAX  from 30 to 29.

**Comment by aabc** [comment]
ipt-netflow sends data using socket API (not raw IP packets) which (socket) should handle MTU natively and fragment the packets as needed (IMHO).

**Comment by ddimension** [comment]
Thanks for your answer. I can confim that fragmentation works, see the pcap.

Because we do not want the pragemented packets, we reduced NETFLOW5_RECORDS_MAX.

I understand this is not a failure. Therefor I'll close this.

**Comment by aabc** [comment]
This could be made into configurable option, though, so you don't need to patch the source each time.
